{
  "canonical_equivalence_class_id": "binary-72-64-hsiao-minimum-odd-column-v1",
  "code_id": "hsiao-secded-72-64-v1",
  "code_spec_id": "hsiao-secded-72-64-v1",
  "content_hashes": {
    "algorithm": "sha256",
    "manifest_sha256": "ddd52755fe11ed039790ab95328b0ddc303e095d81507058b66329f7a6bb1024",
    "matrix_sha256": "1cc658a0e86f0911d0d26def91d61c2b4dc146daaea531a5a923aabf0ca387a7",
    "source_files": {
      "codeforge/artifacts.py": "35960e175985ef375ff77683e1b3566e64814c1768e995a8555220db9775f256",
      "codeforge/gf2.py": "1906d46abb1f4d93e5efcbfdcb4c2260f857be39738574aae1d84da5bb02ee7d",
      "reports/safeforge_decisive_72/code_and_evidence_audit.json": "736ec5f1342cc95a4602227d5d36c5b7c923b0c36009731250b81fea59daa21f"
    }
  },
  "decoder_policy": {
    "nonzero_unknown_syndrome": "DETECTED_UNCORRECTABLE",
    "policy_id": "minimum-weight-single-syndrome-v1"
  },
  "distance_evidence": {
    "designed_distance_lower_bound": 4,
    "exact_minimum_distance": 4,
    "method": "exact dual enumeration plus binary MacWilliams transform"
  },
  "encoder_id": "hsiao-secded-72-64-v1-systematic-encoder",
  "family": "Hsiao SECDED",
  "field": {
    "kind": "GF(2)",
    "order": 2
  },
  "guaranteed_correction_set": [
    {
      "acceptable_statuses": [
        "CORRECTED"
      ],
      "class_id": "all-single-bit-errors",
      "generator": "all_combinations",
      "weight": 1
    }
  ],
  "guaranteed_detection_set": [
    {
      "acceptable_statuses": [
        "CORRECTED",
        "DETECTED_UNCORRECTABLE"
      ],
      "class_id": "all-double-bit-errors",
      "generator": "all_combinations",
      "weight": 2
    }
  ],
  "k": 64,
  "known_miscorrection_domain": [
    {
      "domain": "weight>=3 outside guaranteed SECDED universe",
      "expected_behavior": "may miscorrect"
    }
  ],
  "license": "MIT repository code; cited evidence retains its original provenance",
  "matrix_definition": {
    "deterministic_generator": {
      "callable": "green_ecc_phy.matrices:hsiao_odd_column",
      "parameters": {
        "k": 64,
        "redundancy": 8
      }
    }
  },
  "n": 72,
  "name": "Hsiao minimum-total-ones SECDED (72,64)",
  "proof_references": [
    {
      "path": "codeforge/gf2.py",
      "role": "deterministic matrix construction"
    },
    {
      "path": "reports/safeforge_decisive_72/code_and_evidence_audit.json",
      "role": "classification and prior verification evidence"
    }
  ],
  "puncturing": {
    "enabled": false,
    "parameters": null
  },
  "redundancy": 8,
  "schema_version": 1,
  "shortening": {
    "enabled": false,
    "parameters": null
  },
  "source_provenance": [
    {
      "path": "codeforge/gf2.py",
      "role": "deterministic matrix construction"
    },
    {
      "path": "reports/safeforge_decisive_72/code_and_evidence_audit.json",
      "role": "classification and prior verification evidence"
    }
  ],
  "symbol_width": 1,
  "systematic": {
    "data_positions": [
      0,
      1,
      2,
      3,
      4,
      5,
      6,
      7,
      8,
      9,
      10,
      11,
      12,
      13,
      14,
      15,
      16,
      17,
      18,
      19,
      20,
      21,
      22,
      23,
      24,
      25,
      26,
      27,
      28,
      29,
      30,
      31,
      32,
      33,
      34,
      35,
      36,
      37,
      38,
      39,
      40,
      41,
      42,
      43,
      44,
      45,
      46,
      47,
      48,
      49,
      50,
      51,
      52,
      53,
      54,
      55,
      56,
      57,
      58,
      59,
      60,
      61,
      62,
      63
    ],
    "enabled": true
  },
  "unsupported_error_classes": [
    "guaranteed correction of weight >=2",
    "guaranteed detection of weight >=3"
  ],
  "version": "1.0.0"
}
